{
  "schema_version": "1.0",
  "batch_id": "8cb83dc8-63ca-4e4a-b89c-89ef632de22f",
  "request_id": "f9ea25c4-289e-443a-a837-74303644df41",
  "requested_at": "2026-10-02T10:30:00+07:00",
  "source": "ida-chungtu",
  "email_type": "pgd_response",
  "campaign": {"id": 2, "code": "DEC_001_202606", "name": "Lỗi chứng từ tháng 6", "report_month": "2026-06"},
  "callback": {"url": "https://ida-chungtu.f88.co/api/integrations/power-automate/email/callback/"},
  "messages": [{
    "message_id": "61a633f5-37d9-41e3-90fe-c59d77e08319",
    "idempotency_key": "campaign:2:pgd:4309:link:1256:template:3",
    "target": {"type": "shop", "id": 4309, "code": "PTO21010.340", "name": "Đường Đào Giã"},
    "from": {"address": "phongvanhanh@f88.vn", "name": "Phòng Vận Hành"},
    "to": ["shop-test@f88.co"],
    "cc": ["area-manager-test@f88.vn"],
    "bcc": [],
    "subject": "Lỗi chứng từ bản cứng 06/2026",
    "body": {"content_type": "html", "content": "<div>Kính gửi PGD Đường Đào Giã.<br>Link phản hồi: [REDACTED_TEST_URL]</div>"},
    "metadata": {"shop_link_id": 1256, "template_version": 3, "response_deadline": "2026-10-10T17:30:00+07:00", "link_expires_at": "2026-11-10T17:30:00+07:00"}
  }]
}
